{
    "$schema": "http://json-schema.org/draft-07/schema#",
    "additionalProperties": false,
    "definitions": {
        "ConfigMetadata": {
            "anyOf": [
                {
                    "$ref": "#/definitions/ConfigMetadataBoolean"
                },
                {
                    "$ref": "#/definitions/ConfigMetadataCategorical"
                },
                {
                    "$ref": "#/definitions/ConfigMetadataQuantitative"
                }
            ]
        },
        "ConfigMetadataBoolean": {
            "additionalProperties": false,
            "properties": {
                "column": {
                    "type": "string"
                },
                "label": {
                    "type": "string"
                },
                "labels": {
                    "additionalProperties": false,
                    "properties": {
                        "false": {
                            "type": "string"
                        },
                        "null": {
                            "type": "string"
                        },
                        "true": {
                            "type": "string"
                        }
                    },
                    "type": "object"
                },
                "type": {
                    "enum": [
                        "boolean"
                    ],
                    "type": "string"
                },
                "values": {
                    "additionalProperties": false,
                    "properties": {
                        "false": {
                            "type": "string"
                        },
                        "true": {
                            "type": "string"
                        }
                    },
                    "type": "object"
                }
            },
            "type": "object"
        },
        "ConfigMetadataCategorical": {
            "additionalProperties": false,
            "properties": {
                "column": {
                    "type": "string"
                },
                "label": {
                    "type": "string"
                },
                "type": {
                    "enum": [
                        "categorical"
                    ],
                    "type": "string"
                },
                "width": {
                    "type": "number"
                }
            },
            "type": "object"
        },
        "ConfigMetadataQuantitative": {
            "additionalProperties": false,
            "properties": {
                "column": {
                    "type": "string"
                },
                "decimals": {
                    "type": "number"
                },
                "label": {
                    "type": "string"
                },
                "maxValue": {
                    "type": "number"
                },
                "suffix": {
                    "type": "string"
                },
                "type": {
                    "enum": [
                        "quantitative"
                    ],
                    "type": "string"
                },
                "width": {
                    "type": "number"
                }
            },
            "type": "object"
        }
    },
    "properties": {
        "apiUrl": {
            "type": "string"
        },
        "defaultHomologyId": {
            "type": "number"
        },
        "defaultMetadataColumns": {
            "items": {
                "type": "string"
            },
            "type": "array"
        },
        "filters": {
            "items": {
                "additionalProperties": false,
                "properties": {
                    "column": {
                        "type": "string"
                    },
                    "label": {
                        "type": "string"
                    }
                },
                "type": "object"
            },
            "type": "array"
        },
        "metadata": {
            "items": {
                "$ref": "#/definitions/ConfigMetadata"
            },
            "type": "array"
        },
        "title": {
            "type": "string"
        }
    },
    "type": "object"
}

